{
  "meta": {
    "place_id": "mock_arcadia_pub",
    "slug": "arcadia-pub",
    "owner_id": "danilo",
    "category": "pub",
    "template": "pub",
    "build_mode": "demo",
    "score": 56,
    "generated_at": "2026-07-05T14:22:12.579Z"
  },
  "identity": {
    "name": "Arcadia Pub",
    "claim": "Birra artigianale, come si deve",
    "tone": "cozy"
  },
  "contacts": {
    "phone": {
      "value": "06 1234 5670",
      "source": "google_places"
    },
    "address": {
      "value": "Via dei Laghi 42, 00043 Ciampino RM",
      "maps_url": "https://maps.google.com/?cid=arcadia",
      "source": "google_places"
    },
    "hours": {
      "value": [
        "lunedì: 18:00–01:00",
        "martedì: 18:00–01:00",
        "mercoledì: 18:00–01:00",
        "giovedì: 18:00–01:00",
        "venerdì: 18:00–02:00",
        "sabato: 18:00–02:00",
        "domenica: 18:00–00:00"
      ],
      "source": "google_places"
    }
  },
  "social_proof": {
    "rating": 4.7,
    "count": 384,
    "source": "google_places",
    "themes": [
      {
        "label": "Birra artigianale",
        "evidence_count": 2,
        "source": "derived_from_reviews"
      },
      {
        "label": "Hamburger",
        "evidence_count": 2,
        "source": "derived_from_reviews"
      }
    ],
    "testimonials": [
      {
        "text": "Selezione di birra artigianale pazzesca e hamburger enormi. Il sabato è sempre pieno, consiglio di prenotare.",
        "author": "Cliente G.",
        "source": "derived_from_reviews"
      },
      {
        "text": "Le alette di pollo sono le migliori della zona, atmosfera top e staff gentilissimo.",
        "author": "Cliente M.",
        "source": "derived_from_reviews"
      },
      {
        "text": "Locale sempre affollato, ottima birra e patatine fantastiche. Difficile trovare posto senza prenotazione.",
        "author": "Cliente A.",
        "source": "derived_from_reviews"
      }
    ]
  },
  "gallery": [],
  "loved": [
    {
      "name": "Birra artigianale",
      "source": "derived_from_reviews"
    },
    {
      "name": "Hamburger",
      "source": "derived_from_reviews"
    }
  ],
  "theme": {
    "palette": {
      "bg": "#140f0a",
      "surface": "#221913",
      "primary": "#e08a3c",
      "accent": "#f2c879",
      "text": "#f7efe4",
      "muted": "#b09a82"
    },
    "font_display": "'Fraunces', serif",
    "font_body": "'Inter', sans-serif",
    "fx_intensity": "medium"
  },
  "sections_order": [
    "hero",
    "atmosphere",
    "loved",
    "reviews",
    "hours",
    "contact",
    "cta"
  ],
  "cta": {
    "mode": "demo",
    "headline": "Anteprima per Arcadia Pub",
    "price_setup_eur": 890,
    "price_monthly_eur": 59,
    "guarantee_days": 7,
    "wa_link": "https://wa.me/390612345670?text=Buongiorno!%20Sono%20Danilo%2C%20creo%20siti%20per%20locali%20della%20zona.%20Ho%20preparato%20un'anteprima%20gratuita%20del%20sito%20di%20Arcadia%20Pub%2C%20guardatela%20quando%20volete%3A%20https%3A%2F%2Fapi.local3d.example%2Fd%2Fb63umu8sr49q16ya33e3na%20%E2%80%94%20se%20vi%20piace%20ne%20parliamo%2C%20altrimenti%20nessun%20problema%20%F0%9F%99%82",
    "checkout_url": "https://api.local3d.example/buy/b63umu8sr49q16ya33e3na",
    "track_url": "https://api.local3d.example/track"
  }
}
