{
  "meta": {
    "place_id": "mock_arcadia_pub",
    "slug": "arcadia-pub",
    "owner_id": "danilo",
    "category": "pub",
    "template": "pub",
    "build_mode": "live",
    "score": 56,
    "generated_at": "2026-07-05T11:46:48.326Z"
  },
  "identity": {
    "name": "Arcadia Pub",
    "claim": "Birra artigianale, come si deve",
    "tone": "cozy"
  },
  "contacts": {
    "phone": {
      "value": "06 1234 5670",
      "source": "google_places"
    },
    "address": {
      "value": "Via dei Laghi 42, 00043 Ciampino RM",
      "maps_url": "https://maps.google.com/?cid=arcadia",
      "source": "google_places"
    },
    "hours": {
      "value": [
        "lunedì: 18:00–01:00",
        "martedì: 18:00–01:00",
        "mercoledì: 18:00–01:00",
        "giovedì: 18:00–01:00",
        "venerdì: 18:00–02:00",
        "sabato: 18:00–02:00",
        "domenica: 18:00–00:00"
      ],
      "source": "google_places"
    }
  },
  "social_proof": {
    "rating": 4.7,
    "count": 384,
    "source": "google_places",
    "themes": [
      {
        "label": "Birra artigianale",
        "evidence_count": 2,
        "source": "derived_from_reviews"
      },
      {
        "label": "Hamburger",
        "evidence_count": 2,
        "source": "derived_from_reviews"
      }
    ],
    "testimonials": [
      {
        "text": "Selezione di birra artigianale pazzesca e hamburger enormi. Il sabato è sempre pieno, consiglio di prenotare.",
        "author": "Cliente G.",
        "source": "derived_from_reviews"
      },
      {
        "text": "Le alette di pollo sono le migliori della zona, atmosfera top e staff gentilissimo.",
        "author": "Cliente M.",
        "source": "derived_from_reviews"
      },
      {
        "text": "Locale sempre affollato, ottima birra e patatine fantastiche. Difficile trovare posto senza prenotazione.",
        "author": "Cliente A.",
        "source": "derived_from_reviews"
      }
    ]
  },
  "gallery": [
    {
      "url": "https://picsum.photos/seed/arcadia1/800/600",
      "alt": "Arcadia Pub 1",
      "source": "client_onboarding",
      "rights": "client_provided"
    },
    {
      "url": "https://picsum.photos/seed/arcadia2/800/600",
      "alt": "Arcadia Pub 2",
      "source": "client_onboarding",
      "rights": "client_provided"
    },
    {
      "url": "https://picsum.photos/seed/arcadia3/800/600",
      "alt": "Arcadia Pub 3",
      "source": "client_onboarding",
      "rights": "client_provided"
    }
  ],
  "loved": [
    {
      "name": "Birra artigianale",
      "source": "derived_from_reviews"
    },
    {
      "name": "Hamburger",
      "source": "derived_from_reviews"
    }
  ],
  "theme": {
    "palette": {
      "bg": "#140f0a",
      "surface": "#221913",
      "primary": "#e08a3c",
      "accent": "#f2c879",
      "text": "#f7efe4",
      "muted": "#b09a82"
    },
    "font_display": "'Fraunces', serif",
    "font_body": "'Inter', sans-serif",
    "fx_intensity": "medium"
  },
  "sections_order": [
    "hero",
    "atmosphere",
    "loved",
    "reviews",
    "gallery",
    "hours",
    "contact",
    "cta"
  ],
  "cta": {
    "mode": "live",
    "headline": "Arcadia Pub",
    "price_setup_eur": 890,
    "price_monthly_eur": 59,
    "guarantee_days": 7,
    "wa_link": "",
    "checkout_url": "",
    "track_url": ""
  }
}
