{
  "meta": {
    "place_id": "mock_porchetta_re",
    "slug": "il-re-della-porchetta",
    "owner_id": "danilo",
    "category": "porchetteria",
    "template": "streetfood",
    "build_mode": "demo",
    "score": 46,
    "generated_at": "2026-07-05T06:32:02.819Z"
  },
  "identity": {
    "name": "Il Re della Porchetta",
    "claim": "Porchetta, come si deve",
    "tone": "street"
  },
  "contacts": {
    "phone": {
      "value": "06 9876 5432",
      "source": "google_places"
    },
    "address": {
      "value": "Piazza del Mercato 8, 00044 Frascati RM",
      "maps_url": "https://maps.google.com/?cid=porchetta",
      "source": "google_places"
    },
    "hours": {
      "value": [
        "lunedì: Chiuso",
        "martedì: 10:00–15:00",
        "mercoledì: 10:00–15:00",
        "giovedì: 10:00–15:00",
        "venerdì: 10:00–15:00, 18:00–22:00",
        "sabato: 10:00–22:00",
        "domenica: 10:00–16:00"
      ],
      "source": "google_places"
    }
  },
  "social_proof": {
    "rating": 4.6,
    "count": 512,
    "source": "google_places",
    "themes": [
      {
        "label": "Porchetta",
        "evidence_count": 4,
        "source": "derived_from_reviews"
      },
      {
        "label": "Panino",
        "evidence_count": 2,
        "source": "derived_from_reviews"
      }
    ],
    "testimonials": [
      {
        "text": "La porchetta è leggendaria, il panino più buono dei Castelli. C'è sempre la fila ma ne vale la pena.",
        "author": "Cliente G.",
        "source": "derived_from_reviews"
      },
      {
        "text": "Supplì fantastici e porchetta da urlo. Prenotate per il pranzo della domenica.",
        "author": "Cliente M.",
        "source": "derived_from_reviews"
      },
      {
        "text": "Panino con la porchetta enorme e saporito, salsiccia ottima. Sempre pieno.",
        "author": "Cliente A.",
        "source": "derived_from_reviews"
      }
    ]
  },
  "gallery": [],
  "loved": [
    {
      "name": "Porchetta",
      "source": "derived_from_reviews"
    },
    {
      "name": "Panino",
      "source": "derived_from_reviews"
    }
  ],
  "theme": {
    "palette": {
      "bg": "#0a0a0f",
      "surface": "#15151f",
      "primary": "#ff3d5a",
      "accent": "#ffd23f",
      "text": "#f5f5f7",
      "muted": "#9a9aa8"
    },
    "font_display": "'Anton', sans-serif",
    "font_body": "'Inter', sans-serif",
    "fx_intensity": "high"
  },
  "sections_order": [
    "hero",
    "atmosphere",
    "loved",
    "reviews",
    "hours",
    "contact",
    "cta"
  ],
  "cta": {
    "mode": "demo",
    "headline": "Anteprima per Il Re della Porchetta",
    "price_setup_eur": 890,
    "price_monthly_eur": 59,
    "guarantee_days": 7,
    "wa_link": "https://wa.me/390698765432?text=Buongiorno!%20Sono%20Danilo%2C%20creo%20siti%20per%20locali%20della%20zona.%20Ho%20preparato%20un'anteprima%20gratuita%20del%20sito%20di%20Il%20Re%20della%20Porchetta%2C%20guardatela%20quando%20volete%3A%20https%3A%2F%2Fapi.local3d.example%2Fd%2Fiuo8uijz49fm1ur3nxemyt%20%E2%80%94%20se%20vi%20piace%20ne%20parliamo%2C%20altrimenti%20nessun%20problema%20%F0%9F%99%82",
    "checkout_url": "https://api.local3d.example/buy/iuo8uijz49fm1ur3nxemyt",
    "track_url": "https://api.local3d.example/track"
  }
}
